{"narrative":"The sound reaches you through the soles of your boots.\n\nYou stop halfway up the eastern lighthouse stairs, one hand against the cold inner wall. Above you, the turning mechanism ticks through its accustomed interval. Below, the entrance door shifts in its frame under a draught. Neither accounts for the faint vibration in the stone: three slow strokes, too deep to hear properly, each followed by a silence that seems to press against your teeth.\n\n*Something beneath the cliff is keeping time.*\n\nYou climb the remaining steps. Your knees complain at the last turn, where the stairs narrow, and your shortened fingers slip once on the iron rail. In the lantern room, warm oil and scorched dust mingle with the salt air coming through the ventilation grille. Beyond the glass, Greyhaven’s roofs lie blue in the hour before dawn. The empty bell tower stands above them, its open arches holding nothing but the paling sky.\n\nThe beam passes over the bay.\n\nA row of windows appears beyond the breakwater.\n\nYou catch the railing. There are six windows, low and square, with washing strung between the middle pair. A pale sleeve lifts without wind. Behind the nearest pane stands a figure with one shoulder higher than the other—the posture your mentor carried for the last twelve years of his life.\n\nThen the lantern turns, and there is only water.\n\nYou keep your hand on the railing until the pressure hurts.\n\nFrom the stairwell comes a voice. “Ajax?”\n\nLio Fen stands three steps below the landing, holding a coil of rope against his patched sweater. His white streak of hair is bright in the lamplight; the rest is plastered to his forehead. He has climbed quickly, but he does not seem out of breath. He seems to be listening for someone climbing after him.\n\n“The door was on the latch,” he says. “I knocked. You didn’t answer.”\n\n“You’re wet.”\n\n“Only from the knees down.” He looks at his trousers as though this distinction matters. “I didn’t go into the water.”\n\nYou open the cupboard beneath the workbench and give him a towel. He accepts it with the hand not carrying the rope, wipes his face once, then forgets it.\n\n“I heard it again,” he says.\n\n“The bell?”\n\nHe nods. “Under the fish-market stairs. I thought if I came here, you could tell me whether your light had seen anything.”\n\nThe mechanism ticks. You turn toward the glass before he does.\n\nThis time, the windows are dark. Beneath them a strip of paving shows through the black water, its pale joints forming a straight line toward shore. You know the harbour bottom there. You have watched boats ground on its mud for thirty years.\n\n“There,” Lio whispers.\n\nHis rope shifts against his chest.\n\nYou look down. A loop has tightened around his wrist, though his fingers are open. He notices your gaze and pulls at it with a small, frightened impatience.\n\n“I cut this off the ladder at home,” he says. “Before coming. I wanted somebody to see the knots before I forgot making them.”\n\n“Put it on the bench.”\n\n“I’m trying.”\n\nYou support the coil while he works his wrist free. The rope is cold enough to ache against your palms. Its knots are intricate, folded inward around empty spaces, and from somewhere inside one of those spaces comes a thin trickle of water.\n\nLio backs away. “It was dry when I left.”\n\nThe beam reaches the shoreward end of the paving. For a moment, you see a narrow door set into the cliff below the lighthouse, where no door belongs. Water touches its threshold. Above it, cut into the lintel, is the same branching mark stamped on the oldest volume in your archive.\n\n**Three knocks rise through the stone beneath you.**\n\nLio grips the towel in both hands. “Please,” he says. “Before you go down there, tell me what that mark means.”","quick_actions":[{"text":"Secure the rope and check the tide before descending","kind":"cautious"},{"text":"Go down to the door beneath the lighthouse","kind":"bold"},{"text":"Show Lio the marked archive volume","kind":"social"}],"scene_description":"*A circular lighthouse lantern room before dawn, with curved glass panes, brass lamp machinery, an iron railing, a wooden workbench and a narrow stone stairwell. A broad, stooped brown-skinned man of 58 wears heavy wool work clothes and sturdy leather boots; he has close-cropped silver hair, deep-set hazel eyes, a pale burn scar across his left cheek and two shortened fingers on his right hand. He stands tensely beside a cold, wet coil of intricately knotted rope on the bench. Nearby, a slight 19-year-old man with deep brown skin, tightly curled hair with a white streak above his right temple, patched fishermen’s clothing and damp trouser legs clutches a towel in fear. Beyond the glass are slate cliffs, a quiet harbour, an empty bell tower and faint submerged paving in dark water. Warm lamplight contrasts with blue dawn.*","summary_update":{"current_situation":"Ajax and Lio are in the eastern lighthouse lantern room before dawn. Lio's strange rope is leaking water on the workbench. The beam has revealed a door beneath the lighthouse bearing the mark from Ajax's oldest archive volume, and three knocks have risen through the stone. Lio asks what the mark means.","character_updates":[{"id":"protagonist","current_state":"In the eastern lighthouse lantern room before dawn, physically unharmed but shaken by a silhouette resembling his deceased mentor. Has helped Lio free himself from a rope loop and seen an unknown door beneath the lighthouse marked like his oldest archive volume. Must decide how to respond to the knocks and Lio's question.","name":"","description":"","backstory":"","relationships":""},{"id":"lio-fen","current_state":"In the eastern lighthouse lantern room with Ajax, frightened and wet from the knees down, holding a towel. Brought a rope section cut from his growing ladder after hearing the bell again beneath the fish-market stairs; the rope tightened around his wrist and began leaking water. His wrist is now free, and he asks Ajax to explain the mark above the newly visible door.","name":"","description":"","backstory":"","relationships":""}],"new_major_events":["Ajax's beam reveals drowned windows containing a silhouette resembling his deceased mentor.","Lio brings a section of his strange ladder to Ajax after hearing the bell again beneath the fish-market stairs; the rope tightens by itself and leaks water.","A door beneath the eastern lighthouse appears in its beam, bearing the mark of Ajax's oldest archive volume; three knocks rise through the stone."],"upcoming_events":["Investigate the door beneath the eastern lighthouse and its connection to the oldest archive volume.","Determine why Lio's ladder rope moves by itself and leaks water.","Investigate the bell sounds beneath the fish-market stairs and the familiar silhouette in the drowned windows."],"world":"","consolidated_major_events":[]},"starts_new_chapter":true,"chapter_title":"Three Knocks Beneath the Light"}